[
  {
    "campaign": "Campaign1",
    "industry": "xxx",
    "target": "BrandAwareness",
    "touchpoints": [
      "Touchpoint1",
      "Touchpoint2",
      "Touchpoint5"
    ],
    "Predicted Goal": {
      "Top": 999,
      "Ideal": 777,
      "Low": 555
    },
    "Campaign Totals": {
      "Actual Goal": "785",
      "Conversion Rate": 55.55,
      "Starting Budget": 500.50,
      "Cost": 275.45,
      "Improvements Cost": 150,
      "Success Fee": 75.50,
      "Budget Rollover": 2.50
    }
  },
  {
    "campaign": "Campaign2",
    "industry": "xxx",
    "target": "BrandAwareness",
    "touchpoints": [
      "Touchpoint1",
      "Touchpoint2",
      "Touchpoint5"
    ],
    "Predicted Goal": {
      "Top": 999,
      "Ideal": 777,
      "Low": 555
    },
    "Campaign Totals": {
      "Actual Goal": "785",
      "Conversion Rate": 55.55,
      "Starting Budget": 500.50,
      "Cost": 275.45,
      "Improvements Cost": 150,
      "Success Fee": 75.50,
      "Budget Rollover": 2.50
    }
  },
  {
    "campaign": "Campaign3",
    "industry": "xxx",
    "target": "BrandAwareness",
    "touchpoints": [
      "Touchpoint1",
      "Touchpoint2",
      "Touchpoint5"
    ],
    "Predicted Goal": {
      "Top": 999,
      "Ideal": 777,
      "Low": 555
    },
    "Campaign Totals": {
      "Actual Goal": "785",
      "Conversion Rate": 55.55,
      "Starting Budget": 500.50,
      "Cost": 275.45,
      "Improvements Cost": 150,
      "Success Fee": 75.50,
      "Budget Rollover": 2.50
    }
  },
  {
    "campaign": "Campaign4",
    "industry": "xxx",
    "target": "BrandAwareness",
    "touchpoints": [
      "Touchpoint1",
      "Touchpoint2",
      "Touchpoint5"
    ],
    "Predicted Goal": {
      "Top": 999,
      "Ideal": 777,
      "Low": 555
    },
    "Campaign Totals": {
      "Actual Goal": "785",
      "Conversion Rate": 55.55,
      "Starting Budget": 500.50,
      "Cost": 275.45,
      "Improvements Cost": 150,
      "Success Fee": 75.50,
      "Budget Rollover": 2.50
    }
  },
  {
    "campaign": "Campaign5",
    "industry": "xxx",
    "target": "BrandAwareness",
    "touchpoints": [
      "Touchpoint1",
      "Touchpoint2",
      "Touchpoint5"
    ],
    "Predicted Goal": {
      "Top": 999,
      "Ideal": 777,
      "Low": 555
    },
    "Campaign Totals": {
      "Actual Goal": "785",
      "Conversion Rate": 55.55,
      "Starting Budget": 500.50,
      "Cost": 275.45,
      "Improvements Cost": 150,
      "Success Fee": 75.50,
      "Budget Rollover": 2.50
    }
  },
  {
    "campaign": "Campaign6",
    "industry": "xxx",
    "target": "BrandAwareness",
    "touchpoints": [
      "Touchpoint1",
      "Touchpoint2",
      "Touchpoint5"
    ],
    "Predicted Goal": {
      "Top": 999,
      "Ideal": 777,
      "Low": 555
    },
    "Campaign Totals": {
      "Actual Goal": "785",
      "Conversion Rate": 55.55,
      "Starting Budget": 500.50,
      "Cost": 275.45,
      "Improvements Cost": 150,
      "Success Fee": 75.50,
      "Budget Rollover": 2.50
    }
  },
  {
    "campaign": "Campaign7",
    "industry": "xxx",
    "target": "BrandAwareness",
    "touchpoints": [
      "Touchpoint1",
      "Touchpoint2",
      "Touchpoint5"
    ],
    "Predicted Goal": {
      "Top": 999,
      "Ideal": 777,
      "Low": 555
    },
    "Campaign Totals": {
      "Actual Goal": "785",
      "Conversion Rate": 55.55,
      "Starting Budget": 500.50,
      "Cost": 275.45,
      "Improvements Cost": 150,
      "Success Fee": 75.50,
      "Budget Rollover": 2.50
    }
  },
  {
    "campaign": "Campaign8",
    "industry": "xxx",
    "target": "BrandAwareness",
    "touchpoints": [
      "Touchpoint1",
      "Touchpoint2",
      "Touchpoint5"
    ],
    "Predicted Goal": {
      "Top": 999,
      "Ideal": 777,
      "Low": 555
    },
    "Campaign Totals": {
      "Actual Goal": "785",
      "Conversion Rate": 55.55,
      "Starting Budget": 500.50,
      "Cost": 275.45,
      "Improvements Cost": 150,
      "Success Fee": 75.50,
      "Budget Rollover": 2.50
    }
  }
]